{"agent_id": "sweagent", "benchmark_id": "swe_bench_live", "candidate_id": "fdba011e-5831-5d33-b474-2ca604f6b2e2", "generation_metadata": {"context_mode": "retrieval", "random_seed": 0, "repo_reproduction_used": true, "temperature": 0.0, "tool_configuration": {"source": "dataset_test_patch"}}, "generation_mode": "agent_loop", "model_id": "claude-3-5-sonnet-20241022", "patch_format": "unified_diff", "patch_ref": "patches/sweagent/networkx__networkx-8013.diff", "schema_version": 1, "submitted_at": "2025-05-01T00:00:00Z", "task_id": "networkx__networkx-8013"}
