{"agent_id":"golden_agent","benchmark_id":"rust_swe_bench","candidate_id":"0f3ee971-6b5f-5517-9f4d-5aed74ffce98","generation_metadata":{"context_mode":"full_repo","random_seed":0,"repo_reproduction_used":true,"temperature":0.0,"tool_configuration":{"note":"Candidate patch is the merged upstream PR (fix + tests).","source":"upstream_pr_diff"}},"generation_mode":"human_assisted","model_id":"upstream_pr_diff","patch_format":"unified_diff","patch_ref":"patches/golden_agent/BurntSushi__ripgrep_454.diff","schema_version":1,"submitted_at":"2026-04-23T00:00:00Z","task_id":"BurntSushi__ripgrep_454"}
