{"agent_id": "sweagent", "benchmark_id": "swe_bench_live", "candidate_id": "7092c833-2f81-59b1-8ea0-b6734b462878", "generation_metadata": {"context_mode": "retrieval", "random_seed": 0, "repo_reproduction_used": true, "temperature": 0.0, "tool_configuration": {"source": "dataset_test_patch"}}, "generation_mode": "agent_loop", "model_id": "claude-3-5-sonnet-20241022", "patch_format": "unified_diff", "patch_ref": "patches/sweagent/jlowin__fastmcp-279.diff", "schema_version": 1, "submitted_at": "2025-05-01T00:00:00Z", "task_id": "jlowin__fastmcp-279"}
