{"agent_id":"sweagent","benchmark_id":"swe_bench_verified","candidate_id":"83f1517c-d4cf-58b5-9265-febeec2b8dc2","generation_metadata":{"context_mode":"retrieval","random_seed":null,"repo_reproduction_used":true,"temperature":null,"tool_configuration":{"source":"SWE-bench/experiments","submission_slug":"20240620_sweagent_claude3.5sonnet"}},"generation_mode":"agent_loop","model_id":"claude-3-5-sonnet-20241022","patch_format":"unified_diff","patch_ref":"patches/sweagent/pylint-dev__pylint-7277.diff","schema_version":1,"submitted_at":"2024-09-01T00:00:00Z","task_id":"pylint-dev__pylint-7277"}
