{"agent_id":"gru","benchmark_id":"swe_bench_verified","candidate_id":"98ee27cf-5f29-50ee-9c5d-20f25a7d0044","generation_metadata":{"context_mode":"retrieval","random_seed":null,"repo_reproduction_used":true,"temperature":null,"tool_configuration":{"source":"SWE-bench/experiments","submission_slug":"20240824_gru"}},"generation_mode":"agent_loop","model_id":"gru-2024-08-24","patch_format":"unified_diff","patch_ref":"patches/gru/sphinx-doc__sphinx-9711.diff","schema_version":1,"submitted_at":"2024-09-01T00:00:00Z","task_id":"sphinx-doc__sphinx-9711"}
