{"agent_id": "gru", "benchmark_id": "swe_bench_verified", "candidate_id": "569d9ec3-8484-5ed5-aa9f-d808dfcdb8c6", "generation_metadata": {"context_mode": "retrieval", "random_seed": 0, "repo_reproduction_used": true, "temperature": 0.0, "tool_configuration": {"source": "dataset_patch"}}, "generation_mode": "agent_loop", "model_id": "gru-2024-08-24", "patch_format": "unified_diff", "patch_ref": "patches/gru/pydata__xarray-2905.diff", "schema_version": 1, "submitted_at": "2025-05-01T00:00:00Z", "task_id": "pydata__xarray-2905"}
