{"agent_id":"honeycomb","benchmark_id":"swe_bench_live","candidate_id":"68283574-9d62-55ed-aa9c-92a4b52cd57a","generation_metadata":{"context_mode":"retrieval","random_seed":0,"repo_reproduction_used":true,"temperature":0.0,"tool_configuration":{"source":"dataset_patch"}},"generation_mode":"agent_loop","model_id":"honeycomb-2024-08-20","patch_format":"unified_diff","patch_ref":"patches/honeycomb/jlowin__fastmcp-279.diff","schema_version":1,"submitted_at":"2025-05-01T00:00:00Z","task_id":"jlowin__fastmcp-279"}
