{"agent_id":"gold_patch","benchmark_id":"swe_bench_verified","candidate_id":"ae9527bc-5ade-5486-a179-eff77ba8897f","generation_metadata":{"context_mode":"retrieval","random_seed":0,"repo_reproduction_used":true,"temperature":0.0,"tool_configuration":{"kind":"dataset_patch","source":"datasets/cache/verified/swe_bench_verified.jsonl"}},"generation_mode":"other","model_id":"dataset_patch","patch_format":"unified_diff","patch_ref":"patches/gold_patch/sphinx-doc__sphinx-9698.diff","schema_version":1,"submitted_at":"2025-01-01T00:00:00Z","task_id":"sphinx-doc__sphinx-9698"}
