{"agent_id":"gru","benchmark_id":"swe_bench_verified","candidate_id":"16359d2a-8564-5268-8b70-d133614bfecb","generation_metadata":{"context_mode":"retrieval","random_seed":null,"repo_reproduction_used":true,"temperature":null,"tool_configuration":{"source":"SWE-bench/experiments","submission_slug":"20240824_gru"}},"generation_mode":"agent_loop","model_id":"gru-2024-08-24","patch_format":"unified_diff","patch_ref":"patches/gru/sympy__sympy-21847.diff","schema_version":1,"submitted_at":"2024-09-01T00:00:00Z","task_id":"sympy__sympy-21847"}
