{"agent_id":"honeycomb","benchmark_id":"swe_bench_verified","candidate_id":"b0a3f6fa-7055-58b8-8912-fe216fe0bfba","generation_metadata":{"context_mode":"retrieval","random_seed":null,"repo_reproduction_used":true,"temperature":null,"tool_configuration":{"source":"SWE-bench/experiments","submission_slug":"20240820_honeycomb"}},"generation_mode":"agent_loop","model_id":"honeycomb-2024-08-20","patch_format":"unified_diff","patch_ref":"patches/honeycomb/sphinx-doc__sphinx-9698.diff","schema_version":1,"submitted_at":"2024-09-01T00:00:00Z","task_id":"sphinx-doc__sphinx-9698"}
