{"agent_id":"gru","benchmark_id":"swe_bench_verified","candidate_id":"4613ca31-4e7b-5ef0-a215-f2311a674f6c","generation_metadata":{"context_mode":"retrieval","random_seed":null,"repo_reproduction_used":true,"temperature":null,"tool_configuration":{"source":"SWE-bench/experiments","submission_slug":"20240824_gru"}},"generation_mode":"agent_loop","model_id":"gru-2024-08-24","patch_format":"unified_diff","patch_ref":"patches/gru/pylint-dev__pylint-6903.diff","schema_version":1,"submitted_at":"2024-09-01T00:00:00Z","task_id":"pylint-dev__pylint-6903"}
