{"agent_id":"gru","benchmark_id":"swe_bench_live","candidate_id":"30bf1b5e-16e5-506f-b277-f0b44a91a83d","generation_metadata":{"context_mode":"retrieval","random_seed":0,"repo_reproduction_used":true,"temperature":0.0,"tool_configuration":{"source":"dataset_patch"}},"generation_mode":"agent_loop","model_id":"gru-2024-08-24","patch_format":"unified_diff","patch_ref":"patches/gru/Pyomo__pyomo-3588.diff","schema_version":1,"submitted_at":"2025-05-01T00:00:00Z","task_id":"Pyomo__pyomo-3588"}
